{
  "schema": "status/v1",
  "command": "apply",
  "dry_run": false,
  "hub": {
    "dir": "$HUB",
    "id": "acme-eng",
    "commit": "$COMMIT"
  },
  "target": {
    "root": "$TARGET",
    "ref": "acme/svc",
    "opt_in_file": ".engineering-assets.yml",
    "opted_in": true,
    "opt_in": "file"
  },
  "selection": {
    "packs": [
      "base"
    ],
    "complete": true,
    "unresolved": [],
    "sources": {
      "base": [
        ".engineering-assets.yml"
      ]
    }
  },
  "entries": [
    {
      "path": "tools/run.md",
      "state": "retired",
      "action": "delete",
      "pack": "base",
      "from": "ab2c3a162f81c8c23ca7d9a53ad63e68c58077d1",
      "to": "",
      "mode": "",
      "detail": "no longer shipped by pack base",
      "after_deletes": false
    },
    {
      "path": "handbook",
      "state": "retired",
      "action": "delete",
      "pack": "base",
      "from": "b56665d129d56022c43ce473203f7a0cd2c98b66",
      "to": "",
      "mode": "",
      "detail": "no longer shipped by pack base",
      "after_deletes": false
    },
    {
      "path": ".github/pull_request_template.md",
      "state": "missing",
      "action": "create",
      "pack": "base",
      "from": "",
      "to": "da9823e8fe7223ced65fd1d888c4086c5663d588",
      "mode": "100644",
      "detail": "",
      "after_deletes": false
    },
    {
      "path": "AGENTS.md",
      "state": "missing",
      "action": "create",
      "pack": "base",
      "from": "",
      "to": "f14d69790c939769881dcc505507364b7d1f2f55",
      "mode": "100644",
      "detail": "",
      "after_deletes": false
    },
    {
      "path": "docs/guide.md",
      "state": "missing",
      "action": "create",
      "pack": "base",
      "from": "",
      "to": "b05b6d090e03924f92073d05c2f7471dfc33dc66",
      "mode": "100644",
      "detail": "",
      "after_deletes": false
    },
    {
      "path": "handbook/index.md",
      "state": "missing",
      "action": "create",
      "pack": "base",
      "from": "",
      "to": "2a4d5c2888cfa9ed52b3f949da9e4b4ad05364f4",
      "mode": "100644",
      "detail": "after deleting retired handbook",
      "after_deletes": true
    },
    {
      "path": "tools",
      "state": "missing",
      "action": "create",
      "pack": "base",
      "from": "",
      "to": "9bdf670762e718b952c26e173730a8aa21811ca1",
      "mode": "100644",
      "detail": "after deleting retired files beneath it",
      "after_deletes": true
    }
  ],
  "results": [
    {
      "path": "tools/run.md",
      "action": "delete",
      "state": "retired",
      "outcome": "done",
      "detail": ""
    },
    {
      "path": "handbook",
      "action": "delete",
      "state": "retired",
      "outcome": "done",
      "detail": ""
    },
    {
      "path": ".github/pull_request_template.md",
      "action": "create",
      "state": "missing",
      "outcome": "done",
      "detail": ""
    },
    {
      "path": "AGENTS.md",
      "action": "create",
      "state": "missing",
      "outcome": "done",
      "detail": ""
    },
    {
      "path": "docs/guide.md",
      "action": "create",
      "state": "missing",
      "outcome": "done",
      "detail": ""
    },
    {
      "path": "handbook/index.md",
      "action": "create",
      "state": "missing",
      "outcome": "done",
      "detail": ""
    },
    {
      "path": "tools",
      "action": "create",
      "state": "missing",
      "outcome": "done",
      "detail": ""
    }
  ],
  "summary": {
    "missing": 5,
    "current": 0,
    "outdated": 0,
    "local": 0,
    "ignored": 0,
    "retired": 2,
    "retired_local": 0,
    "unsafe": 0,
    "orphaned": 0,
    "changes": 7,
    "done": 7,
    "skipped": 0,
    "failed": 0
  },
  "warnings": []
}
