{
  "schema": "status/v1",
  "command": "apply",
  "dry_run": false,
  "hub": {
    "dir": "$HUB",
    "id": "",
    "commit": "$COMMIT"
  },
  "target": {
    "root": "$TARGET",
    "ref": "acme/svc",
    "opt_in_file": ".engineering-assets.yml",
    "opted_in": true,
    "opt_in": "file"
  },
  "selection": {
    "packs": [
      "base"
    ],
    "complete": true,
    "unresolved": [],
    "sources": {
      "base": [
        ".engineering-assets.yml"
      ]
    }
  },
  "entries": [
    {
      "path": "AGENTS.md",
      "state": "missing",
      "action": "create",
      "pack": "base",
      "from": "",
      "to": "f14d69790c939769881dcc505507364b7d1f2f55",
      "mode": "100644",
      "detail": "",
      "after_deletes": false
    },
    {
      "path": "docs/guide.md",
      "state": "ignored",
      "action": "keep",
      "pack": "base",
      "from": "",
      "to": "",
      "mode": "",
      "detail": "listed under ignore",
      "after_deletes": false
    }
  ],
  "results": [
    {
      "path": "AGENTS.md",
      "action": "create",
      "state": "missing",
      "outcome": "done",
      "detail": ""
    }
  ],
  "summary": {
    "missing": 1,
    "current": 0,
    "outdated": 0,
    "local": 0,
    "ignored": 1,
    "retired": 0,
    "retired_local": 0,
    "unsafe": 0,
    "orphaned": 0,
    "changes": 1,
    "done": 1,
    "skipped": 0,
    "failed": 0
  },
  "warnings": [
    "hub.yml: not found; legacy hub, every setting has its default",
    "targets.yml: repos: legacy format, read as targets: entries; convert it to version: 1 with targets:"
  ]
}
