{
  "schema": "status/v1",
  "command": "apply",
  "dry_run": false,
  "hub": {
    "dir": "$HUB",
    "id": "acme-eng",
    "commit": "$COMMIT"
  },
  "target": {
    "root": "$TARGET",
    "ref": "acme/svc",
    "opt_in_file": ".engineering-assets.yml",
    "opted_in": true,
    "opt_in": "file"
  },
  "selection": {
    "packs": [
      "base"
    ],
    "complete": true,
    "unresolved": [],
    "sources": {
      "base": [
        ".engineering-assets.yml"
      ]
    }
  },
  "entries": [
    {
      "path": ".github/pull_request_template.md",
      "state": "missing",
      "action": "create",
      "pack": "base",
      "from": "",
      "to": "da9823e8fe7223ced65fd1d888c4086c5663d588",
      "mode": "100644",
      "detail": "",
      "after_deletes": false
    },
    {
      "path": "AGENTS.md",
      "state": "outdated",
      "action": "update",
      "pack": "base",
      "from": "f14d69790c939769881dcc505507364b7d1f2f55",
      "to": "908282fdfae455de2aa05326e524890fba34e505",
      "mode": "100644",
      "detail": "",
      "after_deletes": false
    },
    {
      "path": "NEW.md",
      "state": "missing",
      "action": "create",
      "pack": "base",
      "from": "",
      "to": "d3f01585d6a87379a554c411774bf1db0efe4a09",
      "mode": "100644",
      "detail": "",
      "after_deletes": false
    },
    {
      "path": "docs/guide.md",
      "state": "missing",
      "action": "create",
      "pack": "base",
      "from": "",
      "to": "b05b6d090e03924f92073d05c2f7471dfc33dc66",
      "mode": "100644",
      "detail": "",
      "after_deletes": false
    }
  ],
  "results": [
    {
      "path": ".github/pull_request_template.md",
      "action": "create",
      "state": "missing",
      "outcome": "done",
      "detail": ""
    },
    {
      "path": "AGENTS.md",
      "action": "update",
      "state": "outdated",
      "outcome": "done",
      "detail": ""
    },
    {
      "path": "NEW.md",
      "action": "create",
      "state": "missing",
      "outcome": "done",
      "detail": ""
    },
    {
      "path": "docs/guide.md",
      "action": "create",
      "state": "missing",
      "outcome": "done",
      "detail": ""
    }
  ],
  "summary": {
    "missing": 3,
    "current": 0,
    "outdated": 1,
    "local": 0,
    "ignored": 0,
    "retired": 0,
    "retired_local": 0,
    "unsafe": 0,
    "orphaned": 0,
    "changes": 4,
    "done": 4,
    "skipped": 0,
    "failed": 0
  },
  "warnings": []
}
